  33.0  CTL    80 06 00 02  00 00 3b 00                            GET DESCRIPTOR         151.1.0        
  33.0  IN     09 02 3b 00  02 01 00 a0  32 09 04 00  00 01 03 01  ..;.....2.......       151.2.0        
               01 00 09 21  11 01 00 01  22 41 00 07  05 81 03 08  ...!...."A......       151.2.16       
               00 0c 09 04  01 00 01 03  00 00 00 09  21 11 01 00  ............!...       151.2.32       
               01 22 5b 00  07 05 82 03  08 00 0c                  ."[........            151.2.48       

06：descriptor
3b00: 长度

09 本描述符长度
02: 本描述符为配置描述
3b00 本次数据总长度（一共59字节）

第一
09 02 3b 00  02 01 00 a0 32

32：最大电流 0x32=50，*2，即为100mA

第二 
09 04 00 00 01 03 01 01 00
接口，

三
09 21 11 01 00 01 22 41 00 

07 05 81 03 08 00 0c

四
09 04 01 00 01 03 00 00 00

五
09 21 11 01 00 01 22 5b 00

07 05 82 03 08 00 0c


bDescriptorType 记录               

1：设备描述符
2：配置描述符
3：字符描述符
4：接口描述符
5：终端描述符
0x21：HID描述符
0x22：report描述符


USB键盘的
Device  Phase  Data                                                Description       Cmd.Phase.Ofs(rep)
------  -----  --------------------------------------------------  ----------------  ------------------
  33.0  CTL    80 06 00 01  00 00 12 00                            GET DESCRIPTOR           1.1.0        
  33.0  IN     12 01 10 01  00 00 00 08  6d 02 02 00  01 01 00 00  ........m.......         1.2.0        
               00 01                                               ..                       1.2.16       
  33.0  CTL    80 06 00 02  00 00 09 00                            GET DESCRIPTOR           2.1.0        
  33.0  IN     09 02 3b 00  02 01 00 a0  32                        ..;.....2                2.2.0        
  33.0  CTL    80 06 00 02  00 00 3b 00                            GET DESCRIPTOR           3.1.0        
  33.0  IN     09 02 3b 00  02 01 00 a0  32 09 04 00  00 01 03 01  ..;.....2.......         3.2.0        
               01 00 09 21  11 01 00 01  22 41 00 07  05 81 03 08  ...!...."A......         3.2.16       
               00 0c 09 04  01 00 01 03  00 00 00 09  21 11 01 00  ............!...         3.2.32       
               01 22 5b 00  07 05 82 03  08 00 0c                  ."[........              3.2.48       
  33.0  CTL    00 09 01 00  00 00 00 00                            SET CONFIG               4.1.0        
  34.0  CTL    80 06 00 01  00 00 12 00                            GET DESCRIPTOR           5.1.0        
  34.0  IN     12 01 10 01  00 00 00 08  6d 02 02 00  01 01 00 00  ........m.......         5.2.0        
               00 01                                               ..                       5.2.16       
  34.0  CTL    80 06 00 02  00 00 09 00                            GET DESCRIPTOR           6.1.0        
  34.0  IN     09 02 22 00  01 01 00 a0  32                        ..".....2                6.2.0        
  34.0  CTL    80 06 00 02  00 00 22 00                            GET DESCRIPTOR           7.1.0        
  34.0  IN     09 02 22 00  01 01 00 a0  32 09 04 00  00 01 03 01  ..".....2.......         7.2.0        
               01 00 09 21  11 01 00 01  22 41 00 07  05 81 03 08  ...!...."A......         7.2.16       
               00 0c                                               ..                       7.2.32       
  34.0  CTL    00 09 01 00  00 00 00 00                            SET CONFIG               8.1.0        
  34.0  CTL    21 0a 00 00  00 00 00 00                            SET IDLE                 9.1.0        
  34.0  CTL    81 06 00 22  00 00 81 00                            GET DESCRIPTOR          10.1.0        
  34.0  IN     05 01 09 06  a1 01 05 07  19 e0 29 e7  15 00 25 01  ..........)...%.        10.2.0        
               95 08 75 01  81 02 95 01  75 08 81 03  95 06 75 08  ..u.....u.....u.        10.2.16       
               26 ff 00 05  07 19 00 2a  ff 00 81 00  25 01 95 05  &......*....%...        10.2.32       
               75 01 05 08  19 01 29 05  91 02 95 01  75 03 91 03  u.....).....u...        10.2.48       
               c0                                                  .                       10.2.64       
  35.0  CTL    80 06 00 01  00 00 12 00                            GET DESCRIPTOR          11.1.0        
  35.0  IN     12 01 10 01  00 00 00 08  6d 02 02 00  01 01 00 00  ........m.......        11.2.0        
               00 01                                               ..                      11.2.16       
  35.0  CTL    80 06 00 02  00 00 09 00                            GET DESCRIPTOR          12.1.0        
  35.0  IN     09 02 22 00  01 01 00 a0  32                        ..".....2               12.2.0        
  35.0  CTL    80 06 00 02  00 00 22 00                            GET DESCRIPTOR          13.1.0        
  35.0  IN     09 02 22 00  01 01 00 a0  32 09 04 01  00 01 03 00  ..".....2.......        13.2.0        
               00 00 09 21  11 01 00 01  22 5b 00 07  05 82 03 08  ...!...."[......        13.2.16       
               00 0c                                               ..                      13.2.32       
  35.0  CTL    00 09 01 00  00 00 00 00                            SET CONFIG              14.1.0        
  35.0  CTL    21 0a 00 00  01 00 00 00                            SET IDLE                15.1.0        
  35.0  CTL    81 06 00 22  01 00 9b 00                            GET DESCRIPTOR          16.1.0        
  34.1  IN     00 00 00 00  00 00 00 00                            ........                17.1.0        
  35.0  IN     05 0c 09 01  a1 01 85 01  19 00 2a ff  07 15 00 26  ..........*....&        16.2.0        
               ff 07 95 01  75 10 81 00  c0 05 01 09  06 a1 01 85  ....u...........        16.2.16       
               02 15 00 25  01 05 07 19  00 29 37 75  01 95 38 81  ...%.....)7u..8.        16.2.32       
               02 c0 05 01  09 06 a1 01  85 03 05 07  15 00 25 01  ..............%.        16.2.48       
               19 38 29 67  09 85 09 87  09 88 09 89  09 8a 09 8b  .8)g............        16.2.64       
               09 90 09 91  75 01 95 38  81 02 c0                  ....u..8...             16.2.80     
               
HID设备
报告ID为9的
  47.0  CTL    21 09 09 03  00 00 21 00  SET REPORT               3.1.0        
  47.0  OUT    09 55 54 04  80 00 aa 00  .UT.....                 3.2.0        
               f6 00 77 00  00 00 00 00  ..w.....                 3.2.8        
               00 00 00 00  00 00 00 00  ........                 3.2.16       
               00 00 00 00  00 00 00 00  ........                 3.2.24           
  47.0  CTL    a1 01 09 03  00 00 21 00  GET REPORT               5.1.0(3)     
  47.0  IN     09 3c 3c 3c  3c 3c 3c 3c  .<<<<<<<                 5.2.0        
               3c 3c 3c 3c  3c 3c 3c 3c  <<<<<<<<                 5.2.8        
               3c 3c 3c 3c  3c 3c 3c 3c  <<<<<<<<                 5.2.16       
               3c 3c 3c 3c  3c 3c 3c 3c  <<<<<<<<                 5.2.24       
               3c                        <                        5.2.32      
               
报告ID为0的：
  47.0  CTL    21 09 00 03  00 00 20 00  SET REPORT              19.1.0        
  47.0  OUT    55 54 01 4b  54 44 42 47  UT.KTDBG                19.2.0        
               02 c2 00 00  00 00 00 00  ........                19.2.8        
               00 00 00 00  00 00 00 00  ........                19.2.16       
               00 00 00 00  00 00 00 00  ........                19.2.24       
  47.0  CTL    a1 01 00 03  00 00 20 00  GET REPORT              20.1.0        
  47.0  IN     55 54 01 4b  54 44 42 47  UT.KTDBG                20.2.0        
               03 c3 00 00  00 00 00 00  ........                20.2.8        
               00 00 00 00  00 00 00 00  ........                20.2.16       
               00 00 00 00  00 00 00 00  ........                20.2.24  
               
字符串：
3：字符
  47.0  CTL    80 06 02 03  09 04 02 04  GET DESCRIPTOR          14.1.0(3)     
  47.0  IN     1a 03 54 00  6f 00 75 00  ..T.o.u.                14.2.0        
               63 00 68 00  20 00 53 00  c.h. .S.                14.2.8        
               63 00 72 00  65 00 65 00  c.r.e.e.                14.2.16       
               6e 00                     n.                      14.2.24  


