Bus Hound 6.00 capture on Windows Vista (x64). Complements of www.perisoft.net

  Device - Device ID (followed by the endpoint for USB devices)
            (31) USB Composite Device
            (34) USB Input Device
            (35) USB Input Device
            (36) HID Keyboard Device
            (37) HID-compliant consumer control device
            (38) HID Keyboard Device
            (39) HID Keyboard Device
  Phase  - Phase Type
            CTL   USB control transfer       
            IN    Data in transfer           
            OUT   Data out transfer          
  Data   - Hex dump of the data transferred
  Descr  - Description of the phase
  Cmd... - Position in the captured data


Device  Phase  Data                      Description       Cmd.Phase.Ofs(rep)
------  -----  ------------------------  ----------------  ------------------
  31.0  CTL    80 06 00 01  00 00 12 00  GET DESCRIPTOR           1.1.0        
  31.0  IN     12 01 10 01  00 00 00 08  ........                 1.2.0        
               6d 02 02 00  01 01 00 00  m.......                 1.2.8        
               00 01                     ..                       1.2.16       
  31.0  CTL    80 06 00 02  00 00 09 00  GET DESCRIPTOR           2.1.0        
  31.0  IN     09 02 3b 00  02 01 00 a0  ..;.....                 2.2.0        
               32                        2                        2.2.8        
  31.0  CTL    80 06 00 02  00 00 3b 00  GET DESCRIPTOR           3.1.0        
  31.0  IN     09 02 3b 00  02 01 00 a0  ..;.....                 3.2.0        
               32 09 04 00  00 01 03 01  2.......                 3.2.8        
               01 00 09 21  11 01 00 01  ...!....                 3.2.16       
               22 41 00 07  05 81 03 08  "A......                 3.2.24       
               00 0c 09 04  01 00 01 03  ........                 3.2.32       
               00 00 00 09  21 11 01 00  ....!...                 3.2.40       
               01 22 5b 00  07 05 82 03  ."[.....                 3.2.48       
               08 00 0c                  ...                      3.2.56       
  31.0  CTL    00 09 01 00  00 00 00 00  SET CONFIG               4.1.0        
  34.0  CTL    80 06 00 01  00 00 12 00  GET DESCRIPTOR           5.1.0        
  34.0  IN     12 01 10 01  00 00 00 08  ........                 5.2.0        
               6d 02 02 00  01 01 00 00  m.......                 5.2.8        
               00 01                     ..                       5.2.16       
  34.0  CTL    80 06 00 02  00 00 09 00  GET DESCRIPTOR           6.1.0        
  34.0  IN     09 02 22 00  01 01 00 a0  ..".....                 6.2.0        
               32                        2                        6.2.8        
  34.0  CTL    80 06 00 02  00 00 22 00  GET DESCRIPTOR           7.1.0        
  34.0  IN     09 02 22 00  01 01 00 a0  ..".....                 7.2.0        
               32 09 04 00  00 01 03 01  2.......                 7.2.8        
               01 00 09 21  11 01 00 01  ...!....                 7.2.16       
               22 41 00 07  05 81 03 08  "A......                 7.2.24       
               00 0c                     ..                       7.2.32       
  34.0  CTL    00 09 01 00  00 00 00 00  SET CONFIG               8.1.0        
  34.0  CTL    21 0a 00 00  00 00 00 00  SET IDLE                 9.1.0        
  34.0  CTL    81 06 00 22  00 00 81 00  GET DESCRIPTOR          10.1.0        
  34.0  IN     05 01 09 06  a1 01 05 07  ........                10.2.0        
               19 e0 29 e7  15 00 25 01  ..)...%.                10.2.8        
               95 08 75 01  81 02 95 01  ..u.....                10.2.16       
               75 08 81 03  95 06 75 08  u.....u.                10.2.24       
               26 ff 00 05  07 19 00 2a  &......*                10.2.32       
               ff 00 81 00  25 01 95 05  ....%...                10.2.40       
               75 01 05 08  19 01 29 05  u.....).                10.2.48       
               91 02 95 01  75 03 91 03  ....u...                10.2.56       
               c0                        .                       10.2.64       
  35.0  CTL    80 06 00 01  00 00 12 00  GET DESCRIPTOR          11.1.0        
  35.0  IN     12 01 10 01  00 00 00 08  ........                11.2.0        
               6d 02 02 00  01 01 00 00  m.......                11.2.8        
               00 01                     ..                      11.2.16       
  35.0  CTL    80 06 00 02  00 00 09 00  GET DESCRIPTOR          12.1.0        
  35.0  IN     09 02 22 00  01 01 00 a0  ..".....                12.2.0        
               32                        2                       12.2.8        
  35.0  CTL    80 06 00 02  00 00 22 00  GET DESCRIPTOR          13.1.0        
  35.0  IN     09 02 22 00  01 01 00 a0  ..".....                13.2.0        
               32 09 04 01  00 01 03 00  2.......                13.2.8        
               00 00 09 21  11 01 00 01  ...!....                13.2.16       
               22 5b 00 07  05 82 03 08  "[......                13.2.24       
               00 0c                     ..                      13.2.32       
  35.0  CTL    00 09 01 00  00 00 00 00  SET CONFIG              14.1.0        
  35.0  CTL    21 0a 00 00  01 00 00 00  SET IDLE                15.1.0        
  35.0  CTL    81 06 00 22  01 00 9b 00  GET DESCRIPTOR          16.1.0        
  34.1  IN     00 00 00 00  00 00 00 00  ........                17.1.0        
  35.0  IN     05 0c 09 01  a1 01 85 01  ........                16.2.0        
               19 00 2a ff  07 15 00 26  ..*....&                16.2.8        
               ff 07 95 01  75 10 81 00  ....u...                16.2.16       
               c0 05 01 09  06 a1 01 85  ........                16.2.24       
               02 15 00 25  01 05 07 19  ...%....                16.2.32       
               00 29 37 75  01 95 38 81  .)7u..8.                16.2.40       
               02 c0 05 01  09 06 a1 01  ........                16.2.48       
               85 03 05 07  15 00 25 01  ......%.                16.2.56       
               19 38 29 67  09 85 09 87  .8)g....                16.2.64       
               09 88 09 89  09 8a 09 8b  ........                16.2.72       
               09 90 09 91  75 01 95 38  ....u..8                16.2.80       
               81 02 c0                  ...                     16.2.88       
  35.2  IN     02 00 00 00  00 00 00 00  ........                18.1.0        
  34.0  CTL    21 09 00 02  00 00 01 00  SET REPORT              19.1.0        
  34.0  OUT    00                        .                       19.2.0        
  35.2  IN     03 00 00 00  00 00 00 00  ........                20.1.0        
  34.0  CTL    21 09 00 02  00 00 01 00  SET REPORT              21.1.0(2)     
  34.0  OUT    00                        .                       21.2.0        
  35.2  IN     02 00 00 00  00 00 00 00  ........                23.1.0        
  34.1  IN     00 00 00 00  00 00 00 00  ........                24.1.0        
  35.2  IN     03 00 00 00  00 00 00 00  ........                25.1.0        
  35.2  IN     01 00 00                  ...                     26.1.0        
  37    IN     01 00 00                  ...                     27.1.0(3)     
  31.0  CTL    80 06 00 02  00 00 09 00  GET DESCRIPTOR          30.1.0        
  31.0  IN     09 02 3b 00  02 01 00 a0  ..;.....                30.2.0        
               32                        2                       30.2.8        
  31.0  CTL    80 06 00 02  00 00 3b 00  GET DESCRIPTOR          31.1.0        
  31.0  IN     09 02 3b 00  02 01 00 a0  ..;.....                31.2.0        
               32 09 04 00  00 01 03 01  2.......                31.2.8        
               01 00 09 21  11 01 00 01  ...!....                31.2.16       
               22 41 00 07  05 81 03 08  "A......                31.2.24       
               00 0c 09 04  01 00 01 03  ........                31.2.32       
               00 00 00 09  21 11 01 00  ....!...                31.2.40       
               01 22 5b 00  07 05 82 03  ."[.....                31.2.48       
               08 00 0c                  ...                     31.2.56       
  34.1  IN     01 00 00 00  00 00 00 00  ........                32.1.0        
  36    IN     01 00 1d 00  00 00 00 00  ........                33.1.0        
               00 00 00 00               ....                    33.1.8        